{
  "id": "audio-rhythm",
  "name": "Audio & Rhythm Intelligence",
  "version": "1.0.0",
  "kind": "knowledge",
  "responsibility": "Coordenar som e imagem: extrair dados reais de áudio, sintetizar SFX-rascunho a partir de eventos e planejar impactos, silêncios e sincronia. Distingue medido (audio_map) de estimado (bpm_estimate) e de decisão criativa.",
  "core_contract": 1,
  "docs": [
    "references/audio-rhythm.md"
  ],
  "data": [],
  "scripts": [
    "scripts/audio_map.py",
    "scripts/synth_sfx.py"
  ],
  "consumes": [
    "script"
  ],
  "produces": [
    "script"
  ],
  "depends_on": [],
  "optional_integrations": [],
  "known_errors": [
    "evento de som com tipo desconhecido falha com KeyError em synth_sfx (documentado; validar antes no contrato script.cues)"
  ],
  "limitations": [
    "bpm_estimate é heurística por autocorrelação; SFX sintetizados são rascunho, não master"
  ],
  "verification": {
    "state": "verified",
    "evidence": [
      "tests/test_audio.py"
    ]
  }
}
